<?xml version="1.0" encoding="UTF-8"?>
<!DOCTYPE etd SYSTEM "file:/Users/waingram/Projects/etd_xml/etd.xml.dtd">
<etd>
    <front>
        <title></title>
        <author>
            <given></given>
            <surname></surname>
            <suffix></suffix>
        </author>
        <submission></submission>
        <school></school>
        <degree></degree>
        <major></major>
        <approvals>
            <name></name>
        </approvals>
        <date></date>
        <city></city>
        <state></state>
        <keywords>
            <keyword></keyword>
        </keywords>
        <copyright></copyright>
        <abstract></abstract>
        <grant></grant>
        <dedication>
            <head></head>
            <p></p>
        </dedication>
        <acknowledgments>
            <head></head>
            <p></p>
        </acknowledgments>
    </front>
    <body>
        <chapter>
            <head></head>
            <p></p>
            <section>
                <head></head>
                <p></p>
                <subsection>
                    <head></head>
                    <p></p>
                    <block>
                        <head></head>
                        <p></p>
                        <subblock>
                            <head></head>
                            <p></p>
                        </subblock>
                    </block>
                </subsection>
            </section>
        </chapter>
    </body>
    <back>
        <bibliography>
            <head></head>
            <p></p>
        </bibliography>
        <appendix>
            <head></head>
            <p></p>
            <section>
                <head></head>
                <p></p>
                <subsection>
                    <head></head>
                    <p></p>
                    <block>
                        <head></head>
                        <p></p>
                        <subblock>
                            <head></head>
                            <p></p>
                        </subblock>
                    </block>
                </subsection>
            </section>
        </appendix>
        <vita>
            <head></head>
            <p></p>
        </vita>
    </back>
    <footnote id="x1"></footnote>
</etd>